,premisse,hypothèse,label
359,"L'arbre de mon voisin me dérange, quelles sont les distances de plantation ?",la question concerne la catégorie Justice,1
360,Je me sépare. Comment introduire une demande de mesures urgentes et provisoires devant le tribunal de la famille ?,la question concerne la catégorie Justice,1
361,Est-ce légal de conclure un bail à vie à Bruxelles ?,la question concerne la catégorie Argent,1
362,Mon propriétaire peut-il me réclamer des intérêts de retard en Wallonie ?,la question concerne la catégorie Protection sociale,1
363,Comment mettre fin au bail de commun accord à Bruxelles ?,la question concerne la catégorie Protection sociale,1
364,Dois-je installer des détecteurs incendie à Bruxelles ?,la question concerne la catégorie Travail,1
365,Je suis parent. Dois-je encore payer la contribution alimentaire si mon enfant majeur quitte la maison ?,la question concerne la catégorie Logement,1
366,Les parents ne sont pas mariés ensemble. Quelles démarches effectuer pour être reconnu comme le père de mon enfant si la mère a divorcé moins de 300 jours avant la naissance ?,la question concerne la catégorie Travail,1
367,L'administrateur de biens peut-il s'opposer à une dépense ?,la question concerne la catégorie Etrangers,1
368,Qu’est-ce qu’un bail de rénovation à Bruxelles ?,la question concerne la catégorie Justice,1
369,"Je me sépare. On se sépare, quel est le sort de la maison achetée ensemble ?",la question concerne la catégorie Logement,1
370,Dois-je signaler ma grossesse à l'entretien d'embauche ?,la question concerne la catégorie Justice,1
371,L'administrateur de biens et/ou de la personne peut-il tout faire ?,la question concerne la catégorie Etrangers,1
372,Quelle est la durée d'un bail de colocation à Bruxelles ?,la question concerne la catégorie Travail,1
373,Comment mettre fin au bail de commun accord à Bruxelles ?,la question concerne la catégorie Etrangers,1
374,Je suis victime de violences conjugales. Quels sont mes droits en tant que personne lésée ou partie civile ?,la question concerne la catégorie Travail,1
375,A quoi correspondent les charges à Bruxelles ?,la question concerne la catégorie Justice,1
376,Pourquoi faut-il déclarer l'enfant à la commune ?,la question concerne la catégorie Logement,1
377,Je suis marié(e). Mon conjoint touche un héritage. Est-ce que j'en profite aussi ?,la question concerne la catégorie Travail,1
378,La garantie locative est-elle obligatoire à Bruxelles ?,la question concerne la catégorie Justice,1
379,Où trouver un modèle de requête en matière de bail à Bruxelles ?,la question concerne la catégorie Famille,1
380,Le CPAS peut-il m'aider à constituer une garantie locative à Bruxelles ?,la question concerne la catégorie Protection sociale,1
381,Quand le juge de paix peut-il mettre fin au bail à Bruxelles ?,la question concerne la catégorie Travail,1
382,Je me sépare. A quoi servent les mesures urgentes et provisoires ?,la question concerne la catégorie Logement,1
383,Un enfant mineur peut-il prendre des décisions seul ?,la question concerne la catégorie Etrangers,1
384,"Je n'ai pas de chambre pour chaque enfant, le juge refusera-t-il que j'héberge mes enfants ?",la question concerne la catégorie Justice,1
385,Les père et mère de l'enfant résident séparément. Que faire si je n'arrive pas à me mettre d'accord avec l'autre parent pour une décision concernant notre enfant ?,la question concerne la catégorie Argent,1
386,Je suis grand-parent. Ai-je droit à des contacts avec mes petits-enfants ?,la question concerne la catégorie Argent,1
387,Je suis marié(e). Nous sommes mariés. A qui appartient la voiture ?,la question concerne la catégorie Argent,1
388,"Je suis victime de violences conjugales. En tant que victime de violences conjugales, puis-je demander l'hébergement exclusif de mes enfants ?",la question concerne la catégorie Protection sociale,1
389,Mon propriétaire a mis fin au bail. Puis-je partir avant la fin de son délai de préavis à Bruxelles ?,la question concerne la catégorie Justice,1
390,Qui désigne le tuteur ?,la question concerne la catégorie Travail,1
391,J'ai divorcé par consentement mutuel. Puis-je modifier le montant de la pension alimentaire ?,la question concerne la catégorie Logement,1
392,A quelles conditions puis-je obtenir la prorogation pour circonstances exceptionnelles à Bruxelles ?,la question concerne la catégorie Argent,1
393,Quand et comment constituer une garantie locative à Bruxelles ?,la question concerne la catégorie Travail,1
394,Dois-je avoir l'accord de l’autre parent pour partir en vacances avec mon enfant ?,la question concerne la catégorie Etrangers,1
395,Un colocataire seul peut-il mettre fin au bail non officiel de colocation avant l'échéance en Wallonie ?,la question concerne la catégorie Travail,1
396,Qui peut contester la paternité ou la maternité et dans quel délai ?,la question concerne la catégorie Etrangers,1
397,Puis-je mettre fin à mon bail de courte durée avant l’échéance à Bruxelles ?,la question concerne la catégorie Argent,1
398,Mon bail est-il un bail officiel de colocation à Bruxelles ?,la question concerne la catégorie Travail,1
399,Qui peut introduire la demande de mise sous administration de biens et/ou de la personne ?,la question concerne la catégorie Logement,1
400,Mon propriétaire peut-il m'expulser si je suis en retard de paiement en Wallonie ?,la question concerne la catégorie Famille,1
401,Comment contester un refus d'adresse de référence ?,la question concerne la catégorie Travail,1
402,Je ne suis pas d'accord avec le jugement rendu par le tribunal de la jeunesse. Est-ce que je dispose d'un recours en Wallonie ?,la question concerne la catégorie Argent,1
403,Devant quel tribunal aller en cas de problème lié à la filiation ?,la question concerne la catégorie Etrangers,1
404,Que faire si nous sommes d’accord sur certains points mais pas sur tout ?,la question concerne la catégorie Justice,1
405,Je suis parent. Puis-je demander une augmentation de la contribution alimentaire si ma fille commence des études supérieures ?,la question concerne la catégorie Etrangers,1
406,J'ai signé une déclaration de cohabitation légale. Faut-il ouvrir un compte commun si on est cohabitants légaux ?,la question concerne la catégorie Argent,1
407,Puis-je désigner à l'avance ma personne de confiance ?,la question concerne la catégorie Justice,1
408,"Nous sommes mariés. Nous sommes séparés, vais-je être reconnu comme le père de l'enfant ?",la question concerne la catégorie Justice,1
409,Hébergement d'amis : le propriétaire peut-il m'interdire de le faire à Bruxelles ?,la question concerne la catégorie Argent,1
410,Les parents ne sont pas mariés ensemble. Le père de l'enfant est marié à quelqu'un d'autre que la mère. Peut-on me réclamer une aide financière pour l'enfant si je suis son père biologique mais pas légal ?,la question concerne la catégorie Logement,1
411,Quels sont les entretiens et réparations à charge du locataire à Bruxelles ?,la question concerne la catégorie Justice,1
412,"Les parents sont mariés ensemble. Nous sommes séparés, vais-je être reconnu comme le père de l'enfant ?",la question concerne la catégorie Travail,1
413,Je me sépare. A quoi servent les mesures urgentes et provisoires ?,la question concerne la catégorie Protection sociale,1
414,Nous ne sommes pas mariés. Peut-on me réclamer une aide financière pour l'enfant si je suis son père biologique mais pas légal ?,la question concerne la catégorie Argent,1
415,Les parents ne sont pas mariés ensemble. Peut-on m'obliger à établir un lien de filiation avec mon enfant si ni moi ni la mère ne sommes mariés ?,la question concerne la catégorie Etrangers,1
416,Un colocataire seul peut-il mettre fin au bail non officiel de colocation avant l'échéance à Bruxelles ?,la question concerne la catégorie Justice,1
417,Comment changer de nom ou de prénom ?,la question concerne la catégorie Logement,1
418,Peut-on saisir mes meubles pour les dettes de mon colocataire en Wallonie ?,la question concerne la catégorie Argent,1
419,Mon bail de colocation est-il aussi un bail de résidence principale à Bruxelles ?,la question concerne la catégorie Protection sociale,1
420,Quelles sont les conséquences du bail de résidence principale à Bruxelles ?,la question concerne la catégorie Protection sociale,1
421,Est-ce que je dois faire entretenir la chaudière chaque année à Bruxelles ?,la question concerne la catégorie Protection sociale,1
422,Que faire si je reçois un décompte de charges deux ans après la fin de mon bail en Wallonie ?,la question concerne la catégorie Famille,1
423,Je suis marié(e). Dois-je aider mon conjoint s'il est dans le besoin ?,la question concerne la catégorie Logement,1
424,"Mon propriétaire ne fait pas les réparations nécessaires, puis-je rompre le bail à Bruxelles ?",la question concerne la catégorie Travail,1
425,Le nom de mon enfant est mal orthographié dans son acte de naissance. Puis-je faire corriger cette erreur ?,la question concerne la catégorie Justice,1
426,Je deviens cohabitant légal. Que se passe-t-il en cas de décès de l'un des cohabitants légaux ?,la question concerne la catégorie Justice,1
427,Comment répartir les obligations entre les colocataires à Bruxelles ?,la question concerne la catégorie Famille,1
428,"Le père biologique, mais non légal, doit-il payer une contribution alimentaire pour mon enfant ?",la question concerne la catégorie Argent,1
429,Dois-je payer une pension alimentaire à mes grands-parents et mes arrières grands-parents ?,la question concerne la catégorie Logement,1
430,Comment organiser l'hébergement d'un enfant mineur ?,la question concerne la catégorie Travail,1
431,La personne protégée peut-elle faire un testament ou une donation ?,la question concerne la catégorie Argent,1
432,Le propriétaire peut-il me réclamer des dégâts locatifs après mon départ à Bruxelles ?,la question concerne la catégorie Justice,1
433,Je mets un kot en location (bail de droit commun). Dois-je installer des détecteurs incendie en Wallonie ?,la question concerne la catégorie Travail,1
434,Je suis marié(e). Faut-il ouvrir un compte commun si on est mariés ?,la question concerne la catégorie Etrangers,1
435,Je suis victime de violences conjugales. Que faire si ma plainte pour violences conjugales est classée sans suite ?,la question concerne la catégorie Justice,1
436,J'héberge un ami/un proche. Mon ami est domicilié chez moi. Peut-on saisir mes meubles ?,la question concerne la catégorie Famille,1
437,"A quoi, à qui et quand sert la prorogation pour circonstances exceptionnelles à Bruxelles ?",la question concerne la catégorie Etrangers,1
438,Puis-je faire annuler le bail étudiant que j’ai signé pour l’année prochaine à Bruxelles ?,la question concerne la catégorie Argent,1
439,"Je me sépare. En tant que cohabitants légaux, quelles sont les conséquences de notre séparation sur nos biens ?",la question concerne la catégorie Justice,1
440,Je suis victime de violences conjugales. Comment porter plainte pour violences conjugales ?,la question concerne la catégorie Argent,1
441,Le propriétaire peut-il m'envoyer un décompte des charges deux ans après la fin de mon bail en Wallonie ?,la question concerne la catégorie Travail,1
442,Comment prolonger ou renouveler un bail étudiant à Bruxelles ?,la question concerne la catégorie Protection sociale,1
443,Je deviens cohabitant légal. Nous sommes cohabitants légaux. Qui doit rembourser le crédit hypothécaire ?,la question concerne la catégorie Argent,1
444,Je me sépare. Comment introduire une demande de mesures urgentes et provisoires devant le tribunal de la famille ?,la question concerne la catégorie Justice,1
445,Je divorce. Je divorce pour cause de désunion irrémédiable. Nous sommes d’accord de divorcer. Comment prouver notre séparation de fait ?,la question concerne la catégorie Travail,1
446,Un mineur a signé un contrat de bail. Quelle est la valeur de ce contrat en Wallonie ?,la question concerne la catégorie Famille,1
447,Je divorce. Je divorce pour cause de désunion irrémédiable. Nous sommes d’accord de divorcer. Comment introduire ensemble une demande de divorce pour cause de désunion irrémédiable ?,la question concerne la catégorie Protection sociale,1
448,Je me marie. Quel type de régime matrimonial choisir ?,la question concerne la catégorie Logement,1
449,"Je me sépare. On se sépare, qui doit payer le loyer ?",la question concerne la catégorie Justice,1
450,"Si mon propriétaire fait des travaux dans mon logement, puis-je rompre le bail à Bruxelles ?",la question concerne la catégorie Famille,1
451,Mon propriétaire exige une garantie locative de 3 mois. Est-ce légal à Bruxelles ?,la question concerne la catégorie Protection sociale,1
452,Comment introduire un recours contre la décision d’un organisme de sécurité sociale en Wallonie ?,la question concerne la catégorie Justice,1
453,Que faire si je ne suis pas d’accord avec le jugement du tribunal de la famille ?,la question concerne la catégorie Travail,1
454,Je suis marié(e). Qui doit payer le remboursement d’un prêt si nous sommes mariés ?,la question concerne la catégorie Logement,1
455,Je me marie. Dans quels cas peut-on refuser notre mariage ?,la question concerne la catégorie Justice,1
456,Peut-on réclamer un loyer à un colocataire qui est parti à Bruxelles ?,la question concerne la catégorie Protection sociale,1
457,Je me sépare. Puis-je demander au juge qu’il prenne des mesures urgentes et provisoires par rapport à nos biens ?,la question concerne la catégorie Etrangers,1
458,Que faire si le propriétaire abuse du droit de visite en Wallonie ?,la question concerne la catégorie Famille,1
459,Quelle est la durée d’un bail étudiant à Bruxelles ?,la question concerne la catégorie Protection sociale,1
460,Comment éviter l'expulsion à Bruxelles ?,la question concerne la catégorie Etrangers,1
461,"J'héberge un ami/un proche. Puis-je héberger qui je veux, comme je veux ?",la question concerne la catégorie Argent,1
462,"Je me sépare. En tant que cohabitants légaux, quelles sont les conséquences de notre séparation sur nos biens ?",la question concerne la catégorie Travail,1
463,Je suis parent. Mon ex ne paie pas la contribution alimentaire. Puis-je saisir ses revenus ?,la question concerne la catégorie Logement,1
464,Les parents ne sont pas mariés ensemble. La mère de l'enfant est mariée à quelqu'un d'autre que le père. Devant quel tribunal aller en cas de problème lié à la filiation ?,la question concerne la catégorie Etrangers,1
465,Mon voisin peut-il tondre le dimanche ?,la question concerne la catégorie Protection sociale,1
466,Les parents sont mariés ensemble. Quelles démarches effectuer pour être reconnu comme le père de mon enfant si nous sommes mariés ?,la question concerne la catégorie Protection sociale,1
467,Je deviens cohabitant légal. Nous sommes cohabitants légaux. Dois-je reconnaître notre enfant ?,la question concerne la catégorie Justice,1
468,Puis-je mettre fin à mon bail de longue durée avant l’échéance à Bruxelles ?,la question concerne la catégorie Famille,1
469,Je me marie. Que se passe-t-il si on retarde la célébration de mon mariage ?,la question concerne la catégorie Protection sociale,1
470,"Je me sépare. En tant que cohabitants légaux, quelles mesures peut prendre le juge de la famille pour nos biens et nos dettes ?",la question concerne la catégorie Protection sociale,1
471,"Nous ne sommes pas mariés, quel nom portera notre enfant si son père le reconnaît avant ou à sa naissance ?",la question concerne la catégorie Protection sociale,1
472,Une personne sous protection judiciaire à Bruxelles ?,la question concerne la catégorie Argent,1
473,Je divorce. Je divorce pour cause de désunion irrémédiable. Puis-je demander seul(e) le divorce sur base de notre séparation de fait ?,la question concerne la catégorie Argent,1
474,Les parents ne sont pas mariés ensemble. Le père de l'enfant est marié à quelqu'un d'autre que la mère. Peut-on m'obliger à établir un lien de filiation père/enfant si je suis marié à quelqu'un d'autre que la mère ?,la question concerne la catégorie Argent,1
475,Puis-je m'adresser au juge de paix pour régler un conflit locatif en Wallonie ?,la question concerne la catégorie Protection sociale,1
476,Comment contester la valeur de reprise de la mitoyenneté proposée par l'acheteur ?,la question concerne la catégorie Famille,1
477,Je divorce. Puis-je divorcer sans l'accord de mon conjoint ?,la question concerne la catégorie Justice,1
478,Je me sépare. Que faire si j’estime que les mesures urgentes et provisoires prises par le juge de la famille sont injustes ?,la question concerne la catégorie Argent,1
479,Quel est le rôle du tuteur d'un enfant mineur ?,la question concerne la catégorie Protection sociale,1
480,Peut-on changer d'administrateur de biens et/ou de la personne ?,la question concerne la catégorie Argent,1
481,"Mon propriétaire ne fait pas les réparations nécessaires, puis-je suspendre le paiement de mon loyer à Bruxelles ?",la question concerne la catégorie Protection sociale,1
482,Que faire si le montant des frais et honoraires de l'administrateur semble exagéré ?,la question concerne la catégorie Justice,1
483,Peut-on saisir tous mes revenus ?,la question concerne la catégorie Logement,0
484,Mon cohabitant légal est décédé. Quels sont mes droits dans sa succession ?,la question concerne la catégorie Justice,0
485,"J'introduis une demande en justice. J'ai fait appel du jugement, que se passe-t-il en attendant le nouveau jugement ?",la question concerne la catégorie Famille,0
486,Qu’est-ce que la transaction pénale ?,la question concerne la catégorie Argent,0
487,Va-t-on me ficher si je suis en règlement collectif de dettes ?,la question concerne la catégorie Travail,0
488,Qu'est-ce qu'un crédit hypothécaire ?,la question concerne la catégorie Logement,0
489,Je suis convoqué en justice. Que faire si mon adversaire ne respecte pas la décision de justice ?,la question concerne la catégorie Travail,0
490,Je suis convoqué en justice. Suis-je obligé de prendre un avocat ?,la question concerne la catégorie Travail,0
491,Que se passe-t-il si je suis saisi sur mes revenus et que j'ai d'autres créanciers ?,la question concerne la catégorie Travail,0
492,J'ai été condamné à une peine de prison. A quelles conditions puis-je obtenir la surveillance électronique ?,la question concerne la catégorie Travail,0
493,Après combien de temps ma facture d'eau est-elle prescrite en Wallonie ?,la question concerne la catégorie Logement,0
494,Qui peut demander un règlement collectif de dettes (RCD) ?,la question concerne la catégorie Famille,0
495,Que faire si je ne suis pas d'accord avec une autre décision du juge ?,la question concerne la catégorie Justice,0
496,Suis-je couvert si mon enfant mineur commet un acte intentionnel ?,la question concerne la catégorie Protection sociale,0
497,Comment puis-je être certain que mes proches trouveront mon testament après mon décès ?,la question concerne la catégorie Protection sociale,0
498,"Je ne paie pas mon stationnement, vais-je recevoir une amende pénale ?",la question concerne la catégorie Protection sociale,0
499,Quels sont les revenus pris en compte pour l'aide juridique si je vis seul ?,la question concerne la catégorie Famille,0
500,J'ai été condamné à une peine de prison. Puis-je obtenir une libération conditionnelle ?,la question concerne la catégorie Protection sociale,0
501,"J’ai été condamné à payer une amende pénale, quand dois-je la payer ?",la question concerne la catégorie Protection sociale,0
502,"Je suis convoqué devant le tribunal de police, que va-t-il se passer ?",la question concerne la catégorie Travail,0
503,"J'ai une procédure à l'étranger, que faire ?",la question concerne la catégorie Protection sociale,0
504,Qui va faire exécuter le jugement ?,la question concerne la catégorie Logement,0
505,Comment dois-je renoncer à une succession ?,la question concerne la catégorie Travail,0
506,Puis-je porter plainte au parquet si je suis victime d’une infraction ?,la question concerne la catégorie Protection sociale,0
507,Que faire si un nouveau créancier se manifeste en cours de la procédure en règlement collectif de dettes ?,la question concerne la catégorie Protection sociale,0
508,Je suis convoqué en justice. Qu'est-ce que la requête conjointe (avant appelée comparution volontaire) ?,la question concerne la catégorie Protection sociale,0
509,Combien dois-je payer pour introduire une procédure en justice ?,la question concerne la catégorie Travail,0
510,Quel recours contre une décision du bureau d'aide juridique ?,la question concerne la catégorie Travail,0
511,Le règlement collectif de dettes m'empêche-t-il de rembourser en priorité des amis ou parents qui m'ont prêté de l'argent ?,la question concerne la catégorie Famille,0
512,Comment l'avocat calcule-t-il ses honoraires ?,la question concerne la catégorie Logement,0
513,Quel est le rôle du médiateur de dettes ?,la question concerne la catégorie Logement,0
514,Que se passe-t-il si mon enfant mineur cause un accident avec ma voiture ?,la question concerne la catégorie Justice,0
515,J'introduis une demande en justice. Qu'est-ce qu'une requête ?,la question concerne la catégorie Travail,0
516,Je suis convoqué en justice. Qu'est-ce que le calendrier d'échange de conclusions ?,la question concerne la catégorie Argent,0
517,Je suis convoqué en justice. Qu'est-ce qu'une remise ?,la question concerne la catégorie Etrangers,0
518,Je suis propriétaire. Dois-je installer des détecteurs incendie en Wallonie ?,la question concerne la catégorie Protection sociale,0
519,Qu'est-ce que la saisie mobilière ?,la question concerne la catégorie Etrangers,0
520,Je dépose plainte auprès d'un médiateur. L'entreprise est située en Belgique. Comment le médiateur pour le consommateur traite-t-il ma plainte ?,la question concerne la catégorie Logement,0
521,Quels sont les enfants couverts par une assurance RC familiale ?,la question concerne la catégorie Famille,0
522,J'introduis une demande en justice. Qu'est ce que je risque si je ne respecte pas la décision ?,la question concerne la catégorie Travail,0
523,Qui doit payer le précompte immobilier ?,la question concerne la catégorie Etrangers,0
524,Mon ami est domicilié chez moi. Peut-on saisir mes meubles ?,la question concerne la catégorie Famille,0
525,Après combien de temps ma dette envers mon ami est-elle prescrite ?,la question concerne la catégorie Logement,0
526,Qu'est-ce que la médiation de dettes amiable ?,la question concerne la catégorie Travail,0
527,Mon propriétaire peut-il m'expulser si je ne paie plus mon loyer ?,la question concerne la catégorie Protection sociale,0
528,Que se passe-t-il si je ne paie pas l’amende pénale prévue dans le jugement ?,la question concerne la catégorie Logement,0
529,Je suis convoqué en justice. Je ne suis pas d'accord avec la décision: que faire ?,la question concerne la catégorie Etrangers,0
530,Va-t-on prévenir mon employeur si je suis en règlement collectif de dettes ?,la question concerne la catégorie Etrangers,0
531,Puis-je faire un nouveau crédit à la consommation pour rembourser ceux que j'ai déjà ?,la question concerne la catégorie Travail,0
532,Peut-on m'expulser en hiver ?,la question concerne la catégorie Famille,0
533,Est-ce que toutes les condamnations sont inscrites dans mon extrait de casier judiciaire ?,la question concerne la catégorie Logement,0
534,Mon enfant majeur en “kot” est-il toujours couvert par mon assurance ?,la question concerne la catégorie Travail,0
535,Je suis convoqué en justice. Comment se passe la procédure en appel ?,la question concerne la catégorie Argent,0
536,Que faire si mes conditions de revenus varient lors du règlement collectif de dettes ?,la question concerne la catégorie Travail,0
537,Faut-il un nombre minimum de dettes ou un montant minimum d'endettement pour pouvoir introduire un règlement collectif de dettes (RCD) ?,la question concerne la catégorie Protection sociale,0
538,J'introduis une demande en justice. Qu'est-ce que la requête conjointe (avant appelée comparution volontaire) ?,la question concerne la catégorie Etrangers,0
539,"Si on m'expulse, que fait-on de mes meubles ?",la question concerne la catégorie Justice,0
540,J'introduis une demande en justice. Je ne suis pas d'accord avec la décision: que faire ?,la question concerne la catégorie Logement,0
541,Ai-je droit à l'aide juridique (ex pro deo) si je suis mineur d'âge ?,la question concerne la catégorie Famille,0
542,Comment se déroule la saisie immobilière ?,la question concerne la catégorie Protection sociale,0
543,Où va mon argent pendant la phase de négociation avec les créanciers ?,la question concerne la catégorie Justice,0
544,Que signifie un acte intentionnel dans le cadre d'une assurance familiale ?,la question concerne la catégorie Famille,0
545,Où vais-je devoir travailler pour ma peine de travail ?,la question concerne la catégorie Protection sociale,0
546,Que se passe-t-il si je n’effectue pas correctement ma peine de travail ?,la question concerne la catégorie Famille,0
547,Dans quels cas puis-je être révoqué de la procédure en règlement collectif de dettes ?,la question concerne la catégorie Protection sociale,0
548,L'avocat pro deo peut-il me réclamer des honoraires ?,la question concerne la catégorie Etrangers,0
